conditionId,question,category,open_time,close_time,duration_days,trade_count,is_fed,is_political,has_uma_dispute
0x34fc85e6dcedfb1e8e97e12b04b695424517917bff86f753063e7cf4faefcd10,Mexican Presidential Election: Will Jorge Álvarez Máynez win?,,2024-01-16 00:00:00+00:00,2024-05-30 00:00:00+00:00,135,415551,FALSE,TRUE,TRUE
0x3e81450fe47385e6c2642dd290d91ef98f0fbd16fcde61b5c44855cd02eccd8a,Mexican Presidential Election: Will another candidate win?,,2024-01-16 00:00:00+00:00,2024-05-31 00:00:00+00:00,136,232879,FALSE,TRUE,TRUE
0x9b277b355e9fff465381229667e064abb97ee74934af5e1a2278293f41e69708,Will Dean Phillips win the 2024 Democratic Presidential Nomination?,,2024-01-13 00:00:00+00:00,2024-08-19 00:00:00+00:00,219,22226397,FALSE,TRUE,TRUE
0xbd00b7bbe9cfd644555601eab5e6839d300f157655c7398e52363d65ca31d60e,Will Kamala Harris be the Democratic VP nominee?,,2024-01-17 00:00:00+00:00,2024-08-22 00:00:00+00:00,218,1397015,FALSE,TRUE,TRUE
0xe6137f8637c8a9595dfec6e1f0133d3ab941846d7e80d3d33e5387f57bb5a37c,Will Donald Trump win the South Carolina Republican Primary?,,2024-01-17 00:00:00+00:00,2024-02-21 00:00:00+00:00,35,784485,FALSE,TRUE,TRUE
0xe4bc9d07d1e344fed7a12fc22d6c63e3700d01a12a6abaaec63a86feb0b4da2d,Will Nikki Haley win the South Carolina Republican Primary?,,2024-01-17 00:00:00+00:00,2024-02-21 00:00:00+00:00,35,285432,FALSE,TRUE,TRUE
0xeabadd02f2ac9beb7d8db1065e03391ae88fd67913eaa66c6065c4e2e1166f6e,Will Ron DeSantis win the South Carolina Republican Primary?,,2024-01-17 00:00:00+00:00,2024-02-21 00:00:00+00:00,35,490761,FALSE,TRUE,TRUE
0x81a920b3f81bfab5dd3bf2c3fa1b7be6b2c59937e5999f9cd6ef7e53e7efb61b,Will another candidate win the South Carolina Republican Primary?,,2024-01-17 00:00:00+00:00,2024-02-21 00:00:00+00:00,35,100521,FALSE,TRUE,TRUE
0x48462e8656a17aa1b3f3989121a3c276e1ba2ebc8c9e4b10dea5a33436721a08,NY-3 Special Election for Santos seat: Suozzi (D) vs. Pilip (R),,2024-01-17 00:00:00+00:00,2024-02-13 00:00:00+00:00,27,642842,FALSE,TRUE,TRUE
0xd898154718493ff0aab781ee5db2fbbb44a5712800b571629a5846cdd570cf8d,Will Tim Scott win the 2024 Republican VP nomination?,,2024-01-18 00:00:00+00:00,2024-09-06 00:00:00+00:00,232,4881266,FALSE,TRUE,TRUE
0xf0abd3a7cc2e06aa79553f8c4e92ea18f8bd3d5e075cdc2daf228a16e9ec4156,Will Elise Stefanik win the 2024 Republican VP nomination?,,2024-01-18 00:00:00+00:00,2024-09-06 00:00:00+00:00,232,3416288,FALSE,TRUE,TRUE
0xbb651bf09b0db35efe77e9323eec6f09fbd14ae8b64e118dfb12ad6aeb581682,Will Kristi Noem win the 2024 Republican VP nomination?,,2024-01-18 00:00:00+00:00,2024-09-06 00:00:00+00:00,232,4356530,FALSE,TRUE,TRUE
0x99c0965b13b8374737bf087337afe310fe9fe22d0b2a35d7972cae10ddba2711,Will Vivek Ramaswamy win the 2024 Republican VP nomination?,,2024-01-18 00:00:00+00:00,2024-09-06 00:00:00+00:00,232,6674832,FALSE,TRUE,TRUE
0xcd97873041bcc412c9efec2af8db063bac7f8e2038ec500c6e9af3723b6324cb,Will Nikki Haley win the 2024 Republican VP nomination?,,2024-01-18 00:00:00+00:00,2024-09-06 00:00:00+00:00,232,4569010,FALSE,TRUE,TRUE
0x952e08c11823ace3e9a7c00c2f08eea5cf7d6f3412a2a509efe3dbd16115d21b,Will Kari Lake win the 2024 Republican VP nomination?,,2024-01-18 00:00:00+00:00,2024-09-06 00:00:00+00:00,232,3346195,FALSE,TRUE,TRUE
0xf637b48cfbd112e298d991930c77340c78eb58ee4824b6a408287dadb6663d8a,Will Byron Donalds win the 2024 Republican VP nomination?,,2024-01-18 00:00:00+00:00,2024-09-06 00:00:00+00:00,232,3760323,FALSE,TRUE,TRUE
0xdd866827787d87ade4ac9a515e1e748a2ad39f374f2c522a16ee8faffef4eb4c,Will Robert F. Kennedy Jr. win the 2024 Republican VP nomination?,,2024-01-18 00:00:00+00:00,2024-09-06 00:00:00+00:00,232,4035172,FALSE,TRUE,TRUE
0x57b8a07a436c48ba108848bd3197e1109257dd93b38669b8250bd98f45d71af6,Will Ron DeSantis win the 2024 Republican VP nomination?,,2024-01-18 00:00:00+00:00,2024-09-06 00:00:00+00:00,232,3540382,FALSE,TRUE,TRUE
0xdc0305fbe2b2851d4820af3461fa70c43641cbe4fb0e74dd79bfbd6dc89f170d,Will Tucker Carlson win the 2024 Republican VP nomination?,,2024-01-18 00:00:00+00:00,2024-09-06 00:00:00+00:00,232,6008855,FALSE,TRUE,TRUE
0xcbd8b18d2be8101ca0f467e0840adcc52381c03fde07884c4b1ec0ae8356e0ed,Will Ben Carson win the 2024 Republican VP nomination?,,2024-01-18 00:00:00+00:00,2024-09-06 00:00:00+00:00,232,4993587,FALSE,TRUE,TRUE
0x3ef44f3a40ee5d7a15b319c44e7702d094d0036acc86c9c5991ba90801adddb7,"Will Donald Trump be President of the USA on April 30, 2024?",,2024-01-26 00:00:00+00:00,2024-04-30 00:00:00+00:00,95,134093,FALSE,TRUE,TRUE
0x6e1ccefd084681cfcb06ef028b5a2122aa9d9a45f44dd8e7484e6372b009c6b2,Will Nikki Haley drop out before South Carolina primary?,,2024-01-22 00:00:00+00:00,2024-02-24 00:00:00+00:00,33,649853,FALSE,TRUE,TRUE
0x67b162be33b7a37921d32f8954e4ae8f511b349d28c973f8a860653e0f6f6b90,Trump and Biden debate before Election?,,2024-01-24 00:00:00+00:00,2024-11-05 00:00:00+00:00,286,586007,FALSE,TRUE,TRUE
0x1bd1cfc97238f43b2b054c8b36c213b2288b4b26bfb36872ecffa31e4269ba12,Martha Pollack out as Cornell President before March?,,2024-01-24 00:00:00+00:00,2024-02-29 00:00:00+00:00,36,7371,FALSE,TRUE,TRUE
0x0040859607e99566b86ffbd0c1c40aadb5c6578a956ccef08638b338bfbbf4c9,Minouche Shafik out as Columbia President before March?,,2024-01-24 00:00:00+00:00,2024-02-29 00:00:00+00:00,36,2046,FALSE,TRUE,TRUE
0x6a0bf25cacee15e507476f9bd79acd63a149a5553bd2acbd82972d30ef435366,Will Trump win the South Carolina Primary by between 10-20% of the vote?,,2024-01-25 00:00:00+00:00,2024-02-22 00:00:00+00:00,28,843811,FALSE,TRUE,TRUE
0x8041ffebaa0dcd3e1d192c5aa6185cef14ba9963fff52d0e7f296153cf144539,Will Trump win the South Carolina Primary by between 20-30% of the vote?,,2024-01-25 00:00:00+00:00,2024-02-22 00:00:00+00:00,28,420917,FALSE,TRUE,TRUE
0x315804188956a5ece2ae6e7ebfcc6fdb3ef9e00c4dbdc8af41f705009c6baf07,Will Trump win the South Carolina Primary by between 30-40% of the vote?,,2024-01-25 00:00:00+00:00,2024-02-22 00:00:00+00:00,28,265205,FALSE,TRUE,TRUE
0x4774bdc661b14290b537019240c9d1c3b859126fe4e159636b8f461e0dcf78e0,Will Trump win the South Carolina Primary by between 40-50% of the vote?,,2024-01-25 00:00:00+00:00,2024-02-22 00:00:00+00:00,28,217925,FALSE,TRUE,TRUE
0x25ee65945ec1880c6c62eea7bcd33512d6de23f05ec9a555db332a931a74d22d,Will Trump win the South Carolina Primary by more than 50% of the vote?,,2024-01-25 00:00:00+00:00,2024-02-22 00:00:00+00:00,28,487250,FALSE,TRUE,TRUE
0x9d8a92fee4fd3998176f1d5f90c072d614345c2082a40169d61abf05cb7a9b34,Will Trump win the South Carolina Primary by less than 10% of the vote?,,2024-01-25 00:00:00+00:00,2024-02-22 00:00:00+00:00,28,1109418,FALSE,TRUE,TRUE
0x590559163a05c7e4d56713d51639e94a0c6ee906aee788098cd5487d8bd1836d,Will Sarah Huckabee Sanders win the 2024 Republican VP nomination?,,2024-01-18 00:00:00+00:00,2024-09-05 00:00:00+00:00,231,3213095,FALSE,TRUE,TRUE
0x6a031c4888fcfb886861d3616cce760ea284dbf46e355b197400c2b12a4c37a6,Will JD Vance win the 2024 Republican VP nomination?,,2024-01-18 00:00:00+00:00,2024-09-05 00:00:00+00:00,231,6452293,FALSE,TRUE,TRUE
0xdb1c6497f967a07e89f2956f10edfd3289443e46c6453058f0934ae32936d3a4,Will Katie Britt win the 2024 Republican VP nomination?,,2024-01-18 00:00:00+00:00,2024-09-05 00:00:00+00:00,231,3244929,FALSE,TRUE,TRUE
0x5acad359612174a78b4815a95412aff62fa35ef3411e1bd59fa2fdf7b7699601,Will Nancy Mace win the 2024 Republican VP nomination?,,2024-01-18 00:00:00+00:00,2024-09-05 00:00:00+00:00,231,2126932,FALSE,TRUE,TRUE
0xd013360f1511a7cbb64b70aa0089ce9a0b3f4ebc23dc4a6892e6d38aa8132ea8,Will Marjorie Taylor Greene win the 2024 Republican VP nomination?,,2024-01-18 00:00:00+00:00,2024-09-05 00:00:00+00:00,231,2854968,FALSE,TRUE,TRUE
0x2810294fd661eae12ca2d889d9126fbf6716b8209ff11ec719989ede5766a534,Istanbul Mayoral Election 2024: Will CHP win?,,2024-02-27 00:00:00+00:00,2024-03-31 00:00:00+00:00,33,25660,FALSE,TRUE,TRUE
0x2efede775afc2ce7d2aab10e44e4f7f4cd9acd2ca4b7cafb7d05a0c7eb521c8b,Istanbul Mayoral Election 2024: Will AK win?,,2024-02-27 00:00:00+00:00,2024-03-31 00:00:00+00:00,33,17905,FALSE,TRUE,TRUE
0x3dd5115fa2533aef134177028f8f418c00165b72c33616310fe19cc14ca17177,Istanbul Mayoral Election 2024: Will another party win?,,2024-02-27 00:00:00+00:00,2024-03-31 00:00:00+00:00,33,12022,FALSE,TRUE,TRUE
0xe6927f6c80f48462544d6781fe4aef055c7be28efe77a4e64d597109794aad0a,Will Steve Garvey advance from the 2024 CA Senate Primary?,,2024-01-26 00:00:00+00:00,2024-03-05 00:00:00+00:00,39,35318,FALSE,TRUE,TRUE
0x31aafb7b283edd5c841086cbf43807f2fe53fd36638bfb09e2edefd3b567cfbe,Will Mike Pompeo win the 2024 Republican VP nomination?,,2024-01-30 00:00:00+00:00,2024-09-09 00:00:00+00:00,223,2481274,FALSE,TRUE,TRUE
0xb0f35ef24df5dedc6f05d78dd5227d2d2a9a8389809cb09dd232ab5e52db1cc8,Will Marco Rubio win the 2024 Republican VP nomination?,,2024-01-30 00:00:00+00:00,2024-09-09 00:00:00+00:00,223,3619916,FALSE,TRUE,TRUE
0xaafae2f4f25c0a1785d421d152b2a30cb04042d2370e5a04762fe70abb97d6c4,Will Wesley Hunt win the 2024 Republican VP nomination?,,2024-01-30 00:00:00+00:00,2024-09-09 00:00:00+00:00,223,2202587,FALSE,TRUE,TRUE
0x4b42c17d638e0054120d84a48212d84cfff94bec59d7249c2283f12119861c22,Will Henry McMaster win the 2024 Republican VP nomination?,,2024-01-30 00:00:00+00:00,2024-09-09 00:00:00+00:00,223,1748824,FALSE,TRUE,TRUE
0x6db528a803c762a17e401e751e59c6dd4776e510fb4cc093d2c28f8e1028a945,Will Lee Zeldin win the 2024 Republican VP nomination?,,2024-01-30 00:00:00+00:00,2024-09-09 00:00:00+00:00,223,2680996,FALSE,TRUE,TRUE
0xf4e6589ca397e61af654e4c801569d41b4fa9e97a25a846f625b833d9f964bd0,Will a Trump family member win the 2024 Republican VP nomination?,,2024-01-30 00:00:00+00:00,2024-09-09 00:00:00+00:00,223,3805135,FALSE,TRUE,TRUE
0x3addbd9ce42c7e91ccf7575fb4ebb8b7168d534a7e7d91312746dde58e0a9275,Will another man win the 2024 Republican VP nomination?,,2024-01-30 00:00:00+00:00,2024-09-09 00:00:00+00:00,223,2726180,FALSE,TRUE,TRUE
0x0317ed1eeb46a4f7b517925b61bbf94d8371ba45c58a0c2eb89d447e87aba711,Will another woman win the 2024 Republican VP nomination?,,2024-01-30 00:00:00+00:00,2024-09-09 00:00:00+00:00,223,2952937,FALSE,TRUE,TRUE
0xcdcbe22d75154a6063c32f42319a56d51b72cbc51952f574f0477af36dbcfe93,Will Mike Pence win the 2024 Republican VP nomination?,,2024-01-30 00:00:00+00:00,2024-09-09 00:00:00+00:00,223,2873124,FALSE,TRUE,TRUE
0x25c698987a1021d6cc0ec4a0300d9e2134226bdfefac242b2a1b455e2980c3eb,"Will Joe Biden be President of the United States on June 1, 2024?",,2024-01-30 00:00:00+00:00,2024-06-01 00:00:00+00:00,123,41575,FALSE,TRUE,TRUE
0xb9562403498631638145e360d4d1e6c0b4d6329409fe9a383909efe9eda9a6a0,Ilhan Omar expelled from Congress before March?,,2024-01-31 00:00:00+00:00,2024-02-29 00:00:00+00:00,29,3359,FALSE,TRUE,TRUE
0x86d9fc71e1e67d25d39057f1a35ef79cc905752c373294316dc8c1a6114c5e51,Will Sinema announce she's running for re-election?,,2024-01-31 00:00:00+00:00,2024-04-08 00:00:00+00:00,68,67671,FALSE,TRUE,TRUE
0xfad14932325af166b81190e1f3c0d7ed892357551e5a77f064813f2de5a1b40a,Canada federal election in 2024?,,2024-01-31 00:00:00+00:00,2024-12-31 00:00:00+00:00,335,1863854,FALSE,TRUE,TRUE
0xd4a957e7b51fc2e74c4f1909583972011772eda01aada975251aeaffbbc73f56,Will the Fed decrease interest rates by 50+ bps after its March 2024 meeting?,,2024-01-31 00:00:00+00:00,2024-03-18 00:00:00+00:00,47,13322,TRUE,FALSE,TRUE
0xa1d06c273030c75b85ecfee08b2ff1f0e510c07f12152f81c707eb83deaab8ba,No change in Fed raise interest rates after its 2024 March meeting?,,2024-01-31 00:00:00+00:00,2024-03-18 00:00:00+00:00,47,63023,TRUE,FALSE,TRUE
0x70ee5e1d18a794f36d3c50b7215bd203e00f702d71fa0f0014466f98afe35a09,Will the Fed decrease interest rates by 25 bps after its 2024 March meeting?,,2024-01-31 00:00:00+00:00,2024-03-18 00:00:00+00:00,47,8974,TRUE,FALSE,TRUE
0xdf3b361f2617570e0abc10ece5e350a979c5e1e58ad5a2b5147e023ade4d9311,Will the Fed raise interest rates by 25+ bps after its 2024 March meeting?,,2024-01-31 00:00:00+00:00,2024-03-18 00:00:00+00:00,47,197105,TRUE,FALSE,TRUE
0x1e14c1e407a8aa7a727fadf74049b255a93f1c22f137d6a244ea64604b5b36d5,Fed rate cut by June 12?,,2024-01-31 00:00:00+00:00,2024-06-12 00:00:00+00:00,133,1253483,TRUE,FALSE,TRUE
0x2ef75b6b66c19e98c20c1d6970b3de2d7cfb6eb28680133a7173fb2e158f6863,Will Michelle Obama announce presidential run before August?,,2024-02-01 00:00:00+00:00,2024-07-31 00:00:00+00:00,181,1483098,FALSE,TRUE,TRUE
0x14bf4dd2b3912844e0c58201ace5379208a7c1a421b66e6ce176bce42ef503a9,Will Courtney Najera lose CA-30 primary?,,2024-02-01 00:00:00+00:00,2024-03-05 00:00:00+00:00,33,500,FALSE,TRUE,TRUE
0x5338d1de000b91193e3ea4a066bef50d73c77d0d4ace294e474a236599608dc3,Will Trump election interference trial start in July or earlier?,,2024-02-15 00:00:00+00:00,2024-07-29 00:00:00+00:00,165,21852,FALSE,TRUE,TRUE
0x77ac6afb0079727f461b5ceecab05a3407bd6ae78f59084f7f4054a6c17d5af4,Will Trump election interference trial start in August?,,2024-02-15 00:00:00+00:00,2024-08-29 00:00:00+00:00,196,26789,FALSE,TRUE,TRUE
0xc84158739db6f15f33ad8518b509cd0688baa794209759e628bd025f01927b4c,Will Trump election interference trial start in September or October?,,2024-02-15 00:00:00+00:00,2024-10-29 00:00:00+00:00,257,111271,FALSE,TRUE,TRUE
0x3b692dcdd40f9bfdd313e251c0d5fa4b7cfb60194f321d2e81ef2c846523543d,Trump election interference trial doesn't start before November?,,2024-02-15 00:00:00+00:00,2024-10-30 00:00:00+00:00,258,2039239,FALSE,TRUE,TRUE
0x19120414e0b7b170bb81ab518317f6926c2bb633167e4b11981ef7c078cea739,Fed rate cut by July 31?,,2024-02-13 00:00:00+00:00,2024-07-31 00:00:00+00:00,169,1727507,TRUE,FALSE,TRUE
0x002a797edf040e8a053e62b26d85a0292df091c5cacb303ae31407c8a050a32c,Will Matt Gaetz be expelled from Congress before May?,,2024-02-16 00:00:00+00:00,2024-04-30 00:00:00+00:00,74,65354,FALSE,TRUE,TRUE
0x04787bbd66241501604f377f11b897879c1593b019bb3363dac0a73e99b4a131,Will Fed cut interest rates 0 times in 2024?,,2024-03-21 00:00:00+00:00,2024-12-30 00:00:00+00:00,284,2049580,TRUE,FALSE,TRUE
0xb3e11395bc67c2ad811de3ea4f58d47778e7a7d209eb73bc04a21c5a7472c186,Will Fed cut interest rates 1 time in 2024?,,2024-03-21 00:00:00+00:00,2024-12-30 00:00:00+00:00,284,1407495,TRUE,FALSE,TRUE
0x42e7fa3bd683a276dae0292f0ab910ac18eb76ce7cf014ec9203f6539768735a,Will Fed cut interest rates 2 times in 2024?,,2024-03-21 00:00:00+00:00,2024-12-30 00:00:00+00:00,284,3982525,TRUE,FALSE,TRUE
0x260fd9d6b10746909a26c2af7a68b409f757c95a07dc57ddd480774a36c8399b,Will Fed cut interest rates 3 times in 2024?,,2024-03-21 00:00:00+00:00,2024-12-30 00:00:00+00:00,284,8337156,TRUE,FALSE,TRUE
0x9d1f0296f3a016727193d2b45704e0debc3b8048fe0715f8bb1e91550d321872,Will Fed cut interest rates 4 times in 2024?,,2024-03-21 00:00:00+00:00,2024-12-30 00:00:00+00:00,284,6812524,TRUE,FALSE,TRUE
0x13d3e3531ecc4d6096ffe53c9a34f73ea56ed9b4404f87366e708d3d3a7be699,Will Fed cut interest rates 5 times in 2024?,,2024-03-21 00:00:00+00:00,2024-12-30 00:00:00+00:00,284,6683117,TRUE,FALSE,TRUE
0x1070c27e30447364ed6602778729203d29aaa8860cb0a24779eb3a26f68b245f,Will Fed cut interest rates 6+ times in 2024?,,2024-03-21 00:00:00+00:00,2024-12-30 00:00:00+00:00,284,20169086,TRUE,FALSE,TRUE
0x1b43e21dc696e34154ba0d0a9b351264a86d773bf381ffd0eb5d2124ee783b33,House control after 2024 election?,,2024-02-21 00:00:00+00:00,2024-11-05 00:00:00+00:00,258,7967497,FALSE,TRUE,TRUE
0x29aeefeb4357f5df500f4ed8c23c7a3c88acd4bea02514a7f8ad256651a6829c,Will a Democrat win Alabama Presidential Election?,,2024-03-28 00:00:00+00:00,2024-11-05 00:00:00+00:00,222,101648,FALSE,TRUE,TRUE
0x73e79bf159ec7f40a56830f4f0e27a608a15325e427ae43a06772c1549948885,Will a Republican win Alabama Presidential Election?,,2024-03-28 00:00:00+00:00,2024-11-05 00:00:00+00:00,222,218302,FALSE,TRUE,TRUE
0xda9861827ab29ca4cde17b079dfb9a2434c0d812887919a5f58aac56c29e8875,Will a candidate from another party win Alabama Presidential Election?,,2024-03-28 00:00:00+00:00,2024-11-05 00:00:00+00:00,222,241200,FALSE,TRUE,TRUE
0xc61956bcb19342bb81fd4a033cc8c9375523d6f22c594936635ed2b7f10dd6e9,Will a Democrat win Montana Presidential Election?,,2024-03-28 00:00:00+00:00,2024-11-05 00:00:00+00:00,222,67716,FALSE,TRUE,TRUE
0x015f277ff86323fb0cc3045f6444c5188d9fb491231b644aecd9a08cab9da792,Will a Republican win Montana Presidential Election?,,2024-03-28 00:00:00+00:00,2024-11-05 00:00:00+00:00,222,153723,FALSE,TRUE,TRUE
0x9f599b558efcac7608c06fa26698e4316cdf34d0e36183a837a835cf96db8636,Will a candidate from another party win Montana Presidential Election?,,2024-03-28 00:00:00+00:00,2024-11-05 00:00:00+00:00,222,205722,FALSE,TRUE,TRUE
0x5450fdfa7f5d9198c8bb06894478ab983dcf181c7796a84980fd7fd13d364e7b,Will a Democrat win Nebraska Presidential Election?,,2024-03-28 00:00:00+00:00,2024-11-05 00:00:00+00:00,222,102474,FALSE,TRUE,TRUE
0xc68fce919a7f2836e607b4775777f7bbd9e995d1e6d764408ed0350802abb3db,Will a Democrat win Alaska Presidential Election?,,2024-03-28 00:00:00+00:00,2024-11-05 00:00:00+00:00,222,835760,FALSE,TRUE,TRUE
0xcec7958225b06aa2464a72d934ddcc9b66bb6f35ad065010496d8db92de412a0,Will a Republican win Alaska Presidential Election?,,2024-03-28 00:00:00+00:00,2024-11-05 00:00:00+00:00,222,796279,FALSE,TRUE,TRUE
0x2fc3f33c5e70eaef5cab84fb09703a7b5b54b1e66aecbce0fcc9714d9cac263c,Will a candidate from another party win Alaska Presidential Election?,,2024-03-28 00:00:00+00:00,2024-11-05 00:00:00+00:00,222,426228,FALSE,TRUE,TRUE
0xe3cc8e738278608ba439c84bcab682ac9bb41563f8a82f6c0914f51b5cd40d29,Will a Republican win Nebraska Presidential Election?,,2024-03-28 00:00:00+00:00,2024-11-05 00:00:00+00:00,222,102307,FALSE,TRUE,TRUE
0x8ebedd688fce55ed993a0d3b0d7841296e093551beec0d01f03ff5f636602c50,Will a candidate from another party win Nebraska Presidential Election?,,2024-03-28 00:00:00+00:00,2024-11-05 00:00:00+00:00,222,1040397,FALSE,TRUE,TRUE
0x7d9a43bd2690f796900680ad88d02134d4ba70761c19f2de9ea59c5b6f55830a,Will a Democrat win Arizona Presidential Election?,,2024-03-07 00:00:00+00:00,2024-11-05 00:00:00+00:00,243,5178103,FALSE,TRUE,TRUE
0x4d848bab2da79b9ff7f2b2b0d9ddb048bb1fb47e9f782887f16e91d27de41279,Will a Republican win Arizona Presidential Election?,,2024-03-07 00:00:00+00:00,2024-11-05 00:00:00+00:00,243,5552055,FALSE,TRUE,TRUE
0x8565c04b7cb5c2837d6c3347466a430cbe678a7d6428a48e5750749a26fb815d,Will a candidate from another party win Arizona Presidential Election?,,2024-03-07 00:00:00+00:00,2024-10-31 00:00:00+00:00,238,2968663,FALSE,TRUE,TRUE
0x8f20ff6ed2ba1e234f35e701a50c274ffb64fdd8d621254d017db0445486ab79,Will a Democrat win Nevada Presidential Election?,,2024-03-07 00:00:00+00:00,2024-11-05 00:00:00+00:00,243,5159200,FALSE,TRUE,TRUE
0xdd2f4921a562fc4d18c0bde327d2a9315352a3ba4137656112b9b1770fd1f2a9,Will a Republican win Nevada Presidential Election?,,2024-03-07 00:00:00+00:00,2024-11-05 00:00:00+00:00,243,6181381,FALSE,TRUE,TRUE
0x07c4936f69699d8eccd318bb7faf0a533ffff774d186ff580a9bee9bd5912ebb,Will a Democrat win Arkansas Presidential Election?,,2024-03-28 00:00:00+00:00,2024-11-05 00:00:00+00:00,222,56355,FALSE,TRUE,TRUE
0xfd88c007f9dc1336d16c7109aad896e2aa619656fa38ead87b3e569eed4ceba1,Will a Republican win Arkansas Presidential Election?,,2024-03-28 00:00:00+00:00,2024-11-05 00:00:00+00:00,222,156941,FALSE,TRUE,TRUE
0x5b19d5d3ee794049f4ff27a66d87a7cf3fc55abf317e331988716a7b41f0c297,Will a candidate from another party win Arkansas Presidential Election?,,2024-03-28 00:00:00+00:00,2024-11-05 00:00:00+00:00,222,1808562,FALSE,TRUE,TRUE
0x24ace0c29dc2c801992ea6b7c795d3e7c4f2ad40343bc9f0becef694b2ef197f,Will a Democrat win California Presidential Election?,,2024-03-28 00:00:00+00:00,2024-11-05 00:00:00+00:00,222,1078748,FALSE,TRUE,TRUE
0x6964df311eba3add433112c9ab13ef529c8e2e07e7c115b9cc548de035f5b25f,Will a Republican win California Presidential Election?,,2024-03-28 00:00:00+00:00,2024-11-05 00:00:00+00:00,222,990768,FALSE,TRUE,TRUE
0x844e4eeb91670b5798607d7e120a9f0486407f0df66965cc31c514c2a35a1c1a,Will a candidate from another party win California Presidential Election?,,2024-03-28 00:00:00+00:00,2024-11-05 00:00:00+00:00,222,1065194,FALSE,TRUE,TRUE
0xac5fc54e2b52e942afd4e10a0239df729e4bd9c3c60361f7f7eaae9bbf81fc0a,Will a candidate from another party win Nevada Presidential Election?,,2024-03-07 00:00:00+00:00,2024-11-02 00:00:00+00:00,240,3406977,FALSE,TRUE,TRUE
0x1c4a876957f0c70fb3a579d714c1c125bf14bcc0a6d47073115a1855cd4dd9ab,Will a Democrat win New Hampshire in the 2024 US Presidential Election?,,2024-03-19 00:00:00+00:00,2024-11-05 00:00:00+00:00,231,1829308,FALSE,TRUE,TRUE
0x846be8b2fc96f1033d715aeedcbcb7459945abef9b87599a9e02c27ee1c66b7f,Will a Democrat win Colorado Presidential Election?,,2024-03-28 00:00:00+00:00,2024-11-05 00:00:00+00:00,222,1522857,FALSE,TRUE,TRUE
0x436b731d219f6da8caf7147d02d2a18e31ca770154225aef63c52f632e36e564,Will a Republican win Colorado Presidential Election?,,2024-03-28 00:00:00+00:00,2024-11-05 00:00:00+00:00,222,1022853,FALSE,TRUE,TRUE
0xa9ee4b2076a030846632f4dac3a16f7b503bfbd05ba6e551b0861612e585f1dc,Will a candidate from another party win Colorado Presidential Election?,,2024-03-28 00:00:00+00:00,2024-11-05 00:00:00+00:00,222,2261038,FALSE,TRUE,TRUE
0x9be6760eca88434624ecb3e9dbf3b1ff161c630559c52d80b2b23b8efbcd43bf,Will a Republican win New Hampshire in the 2024 US Presidential Election?,,2024-03-19 00:00:00+00:00,2024-11-05 00:00:00+00:00,231,2083783,FALSE,TRUE,TRUE
0xbfb1fea57597c113c0324915c2982ccff11269ddd3be336cd12b3b5c9781f8a7,Will a candidate from another party win New Hampshire Presidential Election?,,2024-03-19 00:00:00+00:00,2024-11-05 00:00:00+00:00,231,1970001,FALSE,TRUE,TRUE
0x08e0018adf70bd6231208885b49f2e13445a469b0a58831bbc9f6a7a1d136eff,Will a Democrat win Connecticut Presidential Election?,,2024-03-28 00:00:00+00:00,2024-11-05 00:00:00+00:00,222,189595,FALSE,TRUE,TRUE
0x0fb3071db6a07c5e7ec2e94db77ac94d580788aec6f223f618662cb7f3e95cde,Will a Republican win Connecticut Presidential Election?,,2024-03-28 00:00:00+00:00,2024-11-05 00:00:00+00:00,222,152403,FALSE,TRUE,TRUE
0x8abf82eb4647a787edf71dd017852e4bc8219c4e833e3013f861ed989fde38f7,Will a candidate from another party win Connecticut Presidential Election?,,2024-03-28 00:00:00+00:00,2024-11-05 00:00:00+00:00,222,203064,FALSE,TRUE,TRUE
0xfa5a7ff654fb16fbbba2891bb08888d7b876581fed0e09c108919a8ec9732f18,Will a Democrat win New Jersey Presidential Election?,,2024-03-28 00:00:00+00:00,2024-11-05 00:00:00+00:00,222,2778601,FALSE,TRUE,TRUE
0x5f71c0396254199eca645d987c489df1690e6a42eefc9c5b377b7bf68f7ee926,Will a Republican win New Jersey Presidential Election?,,2024-03-28 00:00:00+00:00,2024-11-05 00:00:00+00:00,222,2452014,FALSE,TRUE,TRUE
0x6c21808d100a7c8f630954536fb3cb1449f13749f380859db4b39c27ba8d18c3,Will a candidate from another party win New Jersey Presidential Election?,,2024-03-28 00:00:00+00:00,2024-11-05 00:00:00+00:00,222,1668816,FALSE,TRUE,TRUE
0xf596957aa36f2749bc6f18b15ecb262a4a13d5be5660b39194fc21465d9ddde8,Will a Democrat win Florida in the 2024 US Presidential Election?,,2024-03-19 00:00:00+00:00,2024-11-05 00:00:00+00:00,231,4610012,FALSE,TRUE,TRUE
0x5a06bb8f86198aac8ae8b9a2610f1bdcf8954123dc51d51a3e6c492f88821ba8,Will a Republican win Florida in the 2024 US Presidential Election?,,2024-03-19 00:00:00+00:00,2024-11-05 00:00:00+00:00,231,4017509,FALSE,TRUE,TRUE
0xebeff3ff808378ef45ebdb3795e572beee54ca010b9911a720fc6fab6ae349c0,Will a candidate from another party win Florida Presidential Election?,,2024-03-19 00:00:00+00:00,2024-11-05 00:00:00+00:00,231,4469545,FALSE,TRUE,TRUE
0xe2a9262148bec59cde1581988431069d083faeee3361779c4b0aa265138f7c44,Will a Democrat win Georgia Presidential Election?,,2024-03-07 00:00:00+00:00,2024-11-05 00:00:00+00:00,243,5973401,FALSE,TRUE,TRUE
0x7606802127355512c8f8ff9c70ef27a2717a8554374d84452de4c7d28147338d,Will a Republican win Georgia Presidential Election?,,2024-03-07 00:00:00+00:00,2024-11-05 00:00:00+00:00,243,6457569,FALSE,TRUE,TRUE
0xe1dc4ae259d47a61f59c76462e1f087e94cd027a3c79827f476469f1cf1c1982,Will a candidate from another party win Georgia Presidential Election?,,2024-03-07 00:00:00+00:00,2024-11-03 00:00:00+00:00,241,8662433,FALSE,TRUE,TRUE
0x1d372482a1170a5591237fb8881b1cfe25a1caf69adf58035d406530eb39556d,Will a Democrat win Hawaii Presidential Election?,,2024-03-28 00:00:00+00:00,2024-11-05 00:00:00+00:00,222,671286,FALSE,TRUE,TRUE
0x59032c7e0f729755ce89214f3332f238fb14148e4a9f1c26f76cf0f2e3bbf400,Will a candidate from another party win Hawaii Presidential Election?,,2024-03-28 00:00:00+00:00,2024-11-05 00:00:00+00:00,222,416702,FALSE,TRUE,TRUE
0xf7fb94eb08c13612869e9854a9e57e589c21abea7f7cfc53ab01292844e10c71,Will a Republican win Hawaii Presidential Election?,,2024-03-28 00:00:00+00:00,2024-11-05 00:00:00+00:00,222,1745995,FALSE,TRUE,TRUE
0x8f97d034bbf01cd874af524cefc6d83deaa25373c1ab4545a81589a4d3d2b2a8,Will a Democrat win North Carolina Presidential Election?,,2024-03-08 00:00:00+00:00,2024-11-05 00:00:00+00:00,242,5152322,FALSE,TRUE,TRUE
0x9daebe3fedbc52bbfd311f11862a0f61ec923f9b52b5ea829b82eb04c2450a2b,Will a Democrat win Idaho Presidential Election?,,2024-03-28 00:00:00+00:00,2024-11-05 00:00:00+00:00,222,71733,FALSE,TRUE,TRUE
0xc4efefe6e5ce0d8d4a20efd7fe9f8c90df447341f21fd66f55566d128768cc31,Will a Republican win Idaho Presidential Election?,,2024-03-28 00:00:00+00:00,2024-11-05 00:00:00+00:00,222,147990,FALSE,TRUE,TRUE
0xcb70b74072ac5512db6b9fe14d783a6cd09918aa0663188fcd5e17e459771291,Will a candidate from another party win Idaho Presidential Election?,,2024-03-28 00:00:00+00:00,2024-11-05 00:00:00+00:00,222,46697,FALSE,TRUE,TRUE
0x773f3ca26bdf685da92d2a8a701dd98e4e8b46e0b5366cf09aed9eb8fb6fc189,Will a Republican win North Carolina Presidential Election?,,2024-03-08 00:00:00+00:00,2024-11-05 00:00:00+00:00,242,5796750,FALSE,TRUE,TRUE
0x868de74d879cb10116576295577b377122fdbf45d400c723ee739d17ffa4a68c,Will a candidate from another party win North Carolina Presidential Election?,,2024-03-08 00:00:00+00:00,2024-11-03 00:00:00+00:00,240,4774445,FALSE,TRUE,TRUE
